Business_Name,Category,Location_Address,Specialization,Price_Range,Contact,Customer_Rating,Business_Type,Established_Year,Target_Gender
Kessa,Women's Boutique,Online + Dehradun,Natural fabrics block prints elegant designs,Mid-Premium,,,Online + Physical,,Women
Surbhi Silk & Sarees,Ethnic Boutique,Dehradun,Banarasi Dupattas Silk Sarees,Premium,,,Traditional Boutique,,Women
Kadambari Fashions Radhey & Sons,Ethnic Boutique,Dehradun,Cotton with gold print embroidery,Mid-range,,,Traditional Boutique,,Women
Sangini Collection,Bridal Boutique,Dehradun,Bridal lehengas sarees,Premium,,Highly rated,Bridal Specialist,,Women
Narang Ethnics,Ethnic Boutique,3-story location Dehradun,Ladies attire sarees suits lehengas,Mid to Premium,,Excellent reviews,Multi-floor Boutique,,Women
Gupta Cloth House,Boutique,Dehradun,Designer Kurtis Party Wear Wholesale,Budget to Mid,,,Long-standing Business,1957,Women
Step In Boutique,Ladies Boutique,279 Degree College Road Govindpuri,Custom dresses designer outfits,Mid-range,,,Local Boutique,,Women
Umang Boutique,Premium Boutique,Dehradun,Style and status blend,Premium,,,Luxury Boutique,,Unisex
Nandini Suits and Sarees,Wholesale Boutique,Dehradun,Suits sarees dresses kurties,Wholesale/Budget,,,Wholesale Outlet,,Women
Fresh Tag Clothing Store,Designer Boutique,Crossroad Mall,Latest fashion denim trendy collection,Mid-range,,,Mall-based Boutique,,Unisex
